### ISSUE TITLE
Akka-http 10.2.4: UnexpectedConnectionClosureException after KeepAliveTimeout expires on backend

### ISSUE THREAD

**Issue by marcinkierus** [akka/akka-http#3806]
We have akka-http in version 10.2.4 which acts as a dispatcher of requests to different backend systems. It also puts responses together and server it to the frontend.
The backend systems are behind F5 loadbalancer which is also SSL terminator. As web server we are using apache 2.4.

Occasionally we see 503 errors on the frontend side. When debug is enabled, an exception occurs at the time of the 503 error.

```
[DEBUG] [04/22/2021 10:14:41.466] [integration-akka.actor.default-dispatcher-11] [integration/Pool(shared->https://***:443)] [0 (Idle)]Before event [onNewRequest] In state [Idle] for [5139 ms]
[DEBUG] [04/22/2021 10:14:41.466] [integration-akka.actor.default-dispatcher-11] [integration/Pool(shared->https://***:443)] [0 (PushingRequestToConnection)]After event [onNewRequest] State change [Idle] -> [PushingRequestToConnection]
[DEBUG] [04/22/2021 10:14:41.466] [integration-akka.actor.default-dispatcher-11] [integration/Pool(shared->https://***:443)] [0 (PushingRequestToConnection)]Before event [onRequestDispatched] In state [PushingRequestToConnection] for [0 ms]
[DEBUG] [04/22/2021 10:14:41.466] [integration-akka.actor.default-dispatcher-11] [integration/Pool(shared->https://***:443)] [0 (WaitingForResponse)]After event [onRequestDispatched] State change [PushingRequestToConnection] -> [WaitingForResponse]
[DEBUG] [04/22/2021 10:14:41.474] [integration-akka.actor.default-dispatcher-11] [integration/Pool(shared->https://***:443)] [0 (WaitingForResponse)]Connection failed
[DEBUG] [04/22/2021 10:14:41.474] [integration-akka.actor.default-dispatcher-11] [integration/Pool(shared->https://***:443)] [0 (WaitingForResponse)]Before event [onConnectionFailed] In state [WaitingForResponse] for [7 ms]
[DEBUG] [04/22/2021 10:14:41.474] [integration-akka.actor.default-dispatcher-11] [integration/Pool(shared->https://***:443)] [0 (WaitingForResponse)]Ongoing request [GET /***/*** Empty] is failed because of [connection failure]: [The http server closed the connection unexpectedly before delivering responses for 1 outstanding requests]
[DEBUG] [04/22/2021 10:14:41.474] [integration-akka.actor.default-dispatcher-11] [integration/Pool(shared->https://***:443)] [0 (WaitingForResponseDispatch)]After event [onConnectionFailed] State change [WaitingForResponse] -> [WaitingForResponseDispatch]
[DEBUG] [04/22/2021 10:14:41.474] [integration-akka.actor.default-dispatcher-11] [integration/Pool(shared->https://***:443)] [0 (WaitingForResponseDispatch)]Before event [onResponseDispatchable] In state [WaitingForResponseDispatch] for [0 ms]
[DEBUG] [04/22/2021 10:14:41.474] [integration-akka.actor.default-dispatcher-11] [integration/Pool(shared->https://***:443)] [0 (Failed)]After event [onResponseDispatchable] State change [WaitingForResponseDispatch] -> [Failed]
[DEBUG] [04/22/2021 10:14:41.474] [integration-akka.actor.default-dispatcher-11] [integration/Pool(shared->https://***:443)] [0 (Failed)]State change from [WaitingForResponseDispatch] to [Failed(akka.http.impl.engine.client.OutgoingConnectionBlueprint$UnexpectedConnectionClosureException: The http server closed the connection unexpectedly before delivering responses for 1 outstanding requests)]. Closing the existing connection.
```

To analyze the problem, we recorded network traffic between akka-http and load balancer and noticed that after 5 seconds of inactivity, the backend server closes the connection.
This is expected as the KeepAliveTimeout is set on apache server on default value which is just 5 seconds. However akka-http, even though the connection was finalized, is trying to use it again, which in our opinion is not the correct behavior.

Below is the network traffic for a connection bonded with exception above:

```
10:14:36.326454 IP 10.91.1.10.40046 > 10.91.3.7.443: Flags [.], ack 903090, win 3969, options [nop,nop,TS val 3051972082 ecr 4171573029], length 0
10:14:36.326481 IP 10.91.1.10.40046 > 10.91.3.7.443: Flags [.], ack 910359, win 3969, options [nop,nop,TS val 3051972082 ecr 4171573029], length 0
10:14:36.326661 IP 10.91.1.10.40046 > 10.91.3.7.443: Flags [.], ack 913255, win 3969, options [nop,nop,TS val 3051972082 ecr 4171573029], length 0
10:14:36.326771 IP 10.91.1.10.40046 > 10.91.3.7.443: Flags [.], ack 916180, win 3969, options [nop,nop,TS val 3051972082 ecr 4171573029], length 0
10:14:36.326807 IP 10.91.1.10.40046 > 10.91.3.7.443: Flags [.], ack 916674, win 3969, options [nop,nop,TS val 3051972082 ecr 4171573029], length 0
10:14:36.326901 IP 10.91.3.7.443 > 10.91.1.10.40046: Flags [.], seq 916674:916687, ack 54921, win 65535, options [nop,nop,TS val 4171573030 ecr 3051972082], length 13
10:14:36.326903 IP 10.91.3.7.443 > 10.91.1.10.40046: Flags [.], seq 916687:918135, ack 54921, win 65535, options [nop,nop,TS val 4171573030 ecr 3051972082], length 1448
10:14:36.326905 IP 10.91.3.7.443 > 10.91.1.10.40046: Flags [.], seq 918135:919583, ack 54921, win 65535, options [nop,nop,TS val 4171573030 ecr 3051972082], length 1448
10:14:36.326906 IP 10.91.3.7.443 > 10.91.1.10.40046: Flags [.], seq 919583:921031, ack 54921, win 65535, options [nop,nop,TS val 4171573030 ecr 3051972082], length 1448
10:14:36.326907 IP 10.91.3.7.443 > 10.91.1.10.40046: Flags [.], seq 921031:922479, ack 54921, win 65535, options [nop,nop,TS val 4171573030 ecr 3051972082], length 1448
10:14:36.326908 IP 10.91.3.7.443 > 10.91.1.10.40046: Flags [P.], seq 922479:922495, ack 54921, win 65535, options [nop,nop,TS val 4171573030 ecr 3051972082], length 16
10:14:36.326910 IP 10.91.3.7.443 > 10.91.1.10.40046: Flags [.], seq 922495:922508, ack 54921, win 65535, options [nop,nop,TS val 4171573030 ecr 3051972082], length 13
10:14:36.326911 IP 10.91.3.7.443 > 10.91.1.10.40046: Flags [.], seq 922508:923956, ack 54921, win 65535, options [nop,nop,TS val 4171573030 ecr 3051972082], length 1448
10:14:36.326913 IP 10.91.3.7.443 > 10.91.1.10.40046: Flags [P.], seq 923956:924586, ack 54921, win 65535, options [nop,nop,TS val 4171573030 ecr 3051972082], length 630
10:14:36.327040 IP 10.91.3.7.443 > 10.91.1.10.40046: Flags [P.], seq 924586:924620, ack 54921, win 65535, options [nop,nop,TS val 4171573030 ecr 3051972082], length 34
10:14:36.327115 IP 10.91.1.10.40046 > 10.91.3.7.443: Flags [.], ack 921031, win 3969, options [nop,nop,TS val 3051972082 ecr 4171573030], length 0
10:14:36.327116 IP 10.91.1.10.40046 > 10.91.3.7.443: Flags [.], ack 922479, win 3969, options [nop,nop,TS val 3051972082 ecr 4171573030,nop,nop,sack 1 {922495:922508}], length 0
10:14:36.327184 IP 10.91.1.10.40046 > 10.91.3.7.443: Flags [.], ack 923956, win 3969, options [nop,nop,TS val 3051972082 ecr 4171573030], length 0
10:14:36.327249 IP 10.91.1.10.40046 > 10.91.3.7.443: Flags [.], ack 924586, win 3969, options [nop,nop,TS val 3051972082 ecr 4171573030], length 0
10:14:36.327256 IP 10.91.1.10.40046 > 10.91.3.7.443: Flags [.], ack 924620, win 3969, options [nop,nop,TS val 3051972082 ecr 4171573030], length 0
10:14:41.327136 IP 10.91.3.7.443 > 10.91.1.10.40046: Flags [F.], seq 924620, ack 54921, win 65535, options [nop,nop,TS val 4171578030 ecr 3051972082], length 0
10:14:41.328554 IP 10.91.1.10.40046 > 10.91.3.7.443: Flags [F.], seq 54921, ack 924621, win 3969, options [nop,nop,TS val 3051977084 ecr 4171578030], length 0
10:14:41.328563 IP 10.91.3.7.443 > 10.91.1.10.40046: Flags [.], ack 54922, win 65535, options [nop,nop,TS val 4171578031 ecr 3051977084], length 0
```

As workaround we set KeepAliveTimeout to value higher than our idle-timeout in akka, which solves this problem. But due to heavy traffic, we cannot maintain this value on the production environment due to the risk of a huge number of parallel connections.
We also cannot reduce the idle-timeout because some of our backend services will not have time to respond in the required time.

W noticed #3759 and #3481 tickets but they do not contain any final solution to this issue. We tried to reduce the max-connections-lifetime to 4 seconds but that also doesn't solve the problem.

Currently, this problem is a serious blocker for us which prevents us to go live.

**Comment by marcinkierus** [comment]
We did an additional test with akka-http connected to the backend system (apache) directly omitting F5 loadbalancer and https. We didn't notice any errors.
Moreover in the debug we noticed information that the connections were being closed after exactly 5 seconds, when the keepalive timeout occured.

```
[DEBUG] [04/22/2021 17:32:07.665] [integration-akka.actor.default-dispatcher-15] [integration/Pool(shared->http://***)] [6 (Idle)]Connection completed
[DEBUG] [04/22/2021 17:32:07.665] [integration-akka.actor.default-dispatcher-15] [integration/Pool(shared->http://***)] [6 (Idle)]Before event [onConnectionCompleted] In state [Idle] for [5000 ms]
[DEBUG] [04/22/2021 17:32:07.665] [integration-akka.actor.default-dispatcher-15] [integration/Pool(shared->http://***)] [6 (ToBeClosed)]After event [onConnectionCompleted] State change [Idle] -> [ToBeClosed]
[DEBUG] [04/22/2021 17:32:07.665] [integration-akka.actor.default-dispatcher-15] [integration/Pool(shared->http://***)] [6 (ToBeClosed)]State change from [Idle] to [ToBeClosed]. Closing the existing connection.
```

These logs don't occure when we have akka-http connected through F5 with https.

We suppose that the problem may be connected with https. We are going to check this hypotesis during the test with loadbalancer but without https.

**Comment by jrudolph** [comment]
Thanks for the report, @marcinkierus. I agree with your interpretation. It seems this is an inherent race condition between the server closing the connection and the client sending the next request on an idle persistent connection.

IIUC the problem here is that the `akka.http.client.idle-timeout` governs any kind of no-traffic situation (so it should be set conservatively and rather high before killing a connection waiting for a slow response). Instead, what you would need here would be a more specific timeout which only governs how long a connection is allowed to be idle *between requests* when being reused for another request.

We should introduce a new setting `akka.http.host-connection-pool.max-connection-idle-time` to configure that timeout. It should be relatively easy to implement by adding a `stateTimeout` to the `Idle` state in `SlotState.scala`. When the timeout trigger, the connection state should be set to `ToBeClosed`

**Comment by jrudolph** [comment]
#3816 added a new `keep-alive-timeout` to be able to work around that situation if you know the server-side keep alive timeout.

**Comment by jrudolph** [comment]
I also filed a new ticket for a potential alternative solution: #3834.
