### ISSUE TITLE
Retries on connect timeout

### ISSUE THREAD

**Issue by raghavan-arvind** [akka/akka-http#4471]
Currently connect timeouts are not retried for POST/PATCH requests which are considered idempotent. I agree that on connection reset we can't tell if the server has already started processing the request or not, but I wonder if there is any reason to not allow retries up to `max-retries` on connection timeout errors even for POST/PATCH

**Comment by johanandren** [comment]
Sounds like it could make sense. From a quick look at the retry implementation for idempotent calls, it cannot immediately be piggybacked on that so would require a bit of effort to add.

**Comment by raghavan-arvind** [comment]
Thanks for the response! I think the case we were running into was where the server was not accepting the TCP connection (no response to SYN) and we hit the connect timeout. For us, we are routing through an L4 LB, so simply retrying is usually enough to find a healthy upstream, but I imagine generally we could refresh DNS and retry

**Comment by johanandren** [comment]
If you could try to provide a reproducer or steps to reproduce locally that would be great.

**Comment by raghavan-arvind** [comment]
Here's a version that reproduces for me (our versions are old and we're on scala 2.12 so that might be an issue as well).

First, find some endpoint where we get connection reset (I noticed it's the same for connection reset and black hole). `localhost:8080` works for me locally since there is nothing running there and Mac OS automatically resets localhost (for me, worth double checking).

In one shell:

```
sudo tcpdump -n -i any dst port 8080
```

In another shell:

```
curl localhost:8080
```

In tcpdump I see:

```
22:41:12.703339 IP6 ::1.59527 > ::1.8080: Flags [S], seq 3489025623, win 65535, options [mss 16324,nop,wscale 6,nop,nop,TS val 1047038633 ecr 0,sackOK,eol], length 0
22:41:12.703359 IP6 ::1.59527 > ::1.8080: Flags [S], seq 3489025623, win 65535, options [mss 16324,nop,wscale 6,nop,nop,TS val 1047038633 ecr 0,sackOK,eol], length 0
22:41:12.703503 IP 127.0.0.1.59528 > 127.0.0.1.8080: Flags [S], seq 2125315631, win 65535, options [mss 16344,nop,wscale 6,nop,nop,TS val 1425853684 ecr 0,sackOK,eol], length 0
22:41:12.703538 IP 127.0.0.1.59528 > 127.0.0.1.8080: Flags [S], seq 2125315631, win 65535, options [mss 16344,nop,wscale 6,nop,nop,TS val 1425853684 ecr 0,sackOK,eol], length 0
```

A little surprising but it looks like there are some retries, two SYN packets get sent and then it actually tries again with another source IP. I get the same thing with `curl -X POST localhost:8080`.

The scala example is, `build.sbt`:

```
name := "AkkaHttpMinimalClient"

version := "0.1"

scalaVersion := "2.12.19"

val akkaVersion = "2.7.0"
val akkaHttpVersion = "10.4.0"

libraryDependencies ++= Seq(
  "com.typesafe.akka" %% "akka-actor"  % akkaVersion,
  "com.typesafe.akka" %% "akka-stream" % akkaVersion,
  "com.typesafe.akka" %% "akka-http"   % akkaHttpVersion
)
```

Main.scala:

```
import akka.actor.ActorSystem
import akka.stream.ActorMaterializer
import akka.stream.scaladsl.{Sink, Source}
import akka.http.scaladsl.Http
import akka.http.scaladsl.model._
import akka.http.scaladsl.settings.ConnectionPoolSettings

import scala.util.{Success, Failure}
import scala.concurrent.{Await, Future}
import scala.concurrent.duration._

object Main extends App {
  implicit val system = ActorSystem("HttpClientSystem")
  implicit val materializer = ActorMaterializer()
  import system.dispatcher

  // Set connection pool settings programmatically
  val poolSettings = ConnectionPoolSettings(system).withMaxRetries(3)

  val pool = Http().cachedHostConnectionPool[Unit]("127.0.0.42", 8080, settings = poolSettings)

  val requests = Source.single((HttpRequest(uri = "/"), ()))

  val responseFuture: Future[Unit] =
    requests
      .via(pool)
      .runWith(Sink.head)
      .flatMap {
        case (Success(response), _) =>
          println(s"Got response: ${response.status}")
          response.entity.dataBytes.runForeach(chunk => println(chunk.utf8String)).map(_ => ())

        case (Failure(ex), _) =>
          println(s"Request failed: ${ex.getMessage}")
          Future.successful(())
      }
      .andThen { case _ => system.terminate() }

  Await.result(responseFuture, 30.seconds)
}
```

This initiates a GET request with `max-retries` = `3`. In the tcpdump I see four bursts of packets, each burst has a different source IP. This is great for our use case, different source IP means the LB will send it to a different downstream, and we can configure connect timeout such that it retries as fast as we want -- **amazing!!** for our usecase.

Here's the same thing, three retries, this time with POST (same build.sbt):

```
import akka.actor.ActorSystem
import akka.stream.ActorMaterializer
import akka.stream.scaladsl.{Sink, Source}
import akka.http.scaladsl.Http
import akka.http.scaladsl.model._
import akka.http.scaladsl.settings.ConnectionPoolSettings
import akka.util.ByteString

import scala.util.{Success, Failure}
import scala.concurrent.{Await, Future}
import scala.concurrent.duration._

object Main extends App {
  implicit val system = ActorSystem("HttpClientSystem")
  implicit val materializer = ActorMaterializer()
  import system.dispatcher

  // Connection pool settings with retry support
  val poolSettings = ConnectionPoolSettings(system).withMaxRetries(3)

  val pool = Http().cachedHostConnectionPool[Unit]("127.0.0.1", 8080, settings = poolSettings)

  // Define the POST request
  val jsonPayload = """{"message": "hello"}"""
  val entity = HttpEntity(ContentTypes.`application/json`, ByteString(jsonPayload))

  val postRequest = HttpRequest(
    method = HttpMethods.POST,
    uri = "/",
    entity = entity
  )

  val requests = Source.single((postRequest, ()))

  val responseFuture: Future[Unit] =
    requests
      .via(pool)
      .runWith(Sink.head)
      .flatMap {
        case (Success(response), _) =>
          println(s"Got response: ${response.status}")
          response.entity.dataBytes.runForeach(chunk => println(chunk.utf8String)).map(_ => ())

        case (Failure(ex), _) =>
          println(s"Request failed: ${ex.getMessage}")
          Future.successful(())
      }
      .andThen { case _ => system.terminate() }

  Await.result(responseFuture, 30.seconds)
}
```

This time I see:
```
22:47:00.949906 IP 127.0.0.1.60013 > 127.0.0.1.8080: Flags [S], seq 3353561783, win 65535, options [mss 16344,nop,wscale 6,nop,nop,TS val 2697315485 ecr 0,sackOK,eol], length 0
22:47:00.949928 IP 127.0.0.1.60013 > 127.0.0.1.8080: Flags [S], seq 3353561783, win 65535, options [mss 16344,nop,wscale 6,nop,nop,TS val 2697315485 ecr 0,sackOK,eol], length 0
```

so immediate failure and this gets printed: 

```
Request failed: Tcp command [Connect(127.0.0.1:8080,None,List(),Some(10 seconds),true)] failed because of java.net.ConnectException: Connection refused
```

If we can make the POST behavior mimic the GET behavior, then we can fully delegate all of our TCP layer to akka-http which would be really nice.
