### ISSUE TITLE
No SNI when using explicit port

### ISSUE THREAD

**Issue by mpdn** [akka/akka-http#3255]
When making a HTTPS request, the TLS client hello does not include the SNI extension if using an explicit port.

The [docs](https://doc.akka.io/docs/akka-http/current/client-side/client-https-support.html#server-name-indication-sni-) seem to indicate that SNI is enabled by default, that it protects against MITM attacks (this seems incorrect), and that turning it off is an unsafe option and a "very bad idea".

I don't really see how SNI can be a security feature, but due to how it was presented in the docs I originally sent this to the security@akka.io. According to @jroper SNI should not be a security issue, so an open GH issue here is better.

Example
=======

```scala
import akka.actor.ActorSystem
import akka.http.scaladsl.Http
import akka.http.scaladsl.model.HttpRequest

import scala.concurrent.duration._
import scala.concurrent.{Await, ExecutionContextExecutor, Future}

object Main {
  def main(args: Array[String]): Unit = {
    implicit val system: ActorSystem = ActorSystem()
    implicit val executionContext: ExecutionContextExecutor = system.dispatcher

    val timeout = Duration(10, SECONDS)

    def await[T](fut: Future[T]) = Await.result(fut, timeout)

    def sniTest(uri: String) = {
      val response = Http().singleRequest(HttpRequest(uri = uri))
      println(await(await(response).entity.toStrict(timeout)).getData().utf8String)
    }

    println("Without explicit port:")
    sniTest("https://check-tls.akamaized.net/v1/tlssni.json")

    println("With explicit port:")
    sniTest("https://check-tls.akamaized.net/v1/tlssni.json:80")
  }
}

```

Outputs:

```
Without explicit port:
{
"tls_sni_status": "present",
"scheme": "https",
"tls_version": "tls1.2",
"tls_sni_value": "check-tls.akamaized.net",
"host_header_value": "check-tls.akamaized.net",
"tls_cipher_name": "ECDHE-ECDSA-AES128-GCM-SHA256",
"alpn": "",
"client_ip": "194.182.8.167",
"client_ip_version": "ipv4",
"client_port": 57700,
"user_agent": "akka-http%2f10.1.12",
"output_version": "0.1.21",
"timestamp": 1592290268
}

With explicit port:
Not found
```

Client hello output from wireshark:

```
Frame 87: 369 bytes on wire (2952 bits), 369 bytes captured (2952 bits) on interface lo, id 0
Ethernet II, Src: 00:00:00_00:00:00 (00:00:00:00:00:00), Dst: 00:00:00_00:00:00 (00:00:00:00:00:00)
Internet Protocol Version 4, Src: 127.0.0.1, Dst: 127.0.0.1
Transmission Control Protocol, Src Port: 44426, Dst Port: 8081, Seq: 1, Ack: 1, Len: 303
Transport Layer Security
    TLSv1.2 Record Layer: Handshake Protocol: Client Hello
        Content Type: Handshake (22)
        Version: TLS 1.2 (0x0303)
        Length: 298
        Handshake Protocol: Client Hello
            Handshake Type: Client Hello (1)
            Length: 294
            Version: TLS 1.2 (0x0303)
            Random: 2348f6c1f02cebc7d8b294d3e262d568f4987509681b0897…
            Session ID Length: 0
            Cipher Suites Length: 92
            Cipher Suites (46 suites)
            Compression Methods Length: 1
            Compression Methods (1 method)
            Extensions Length: 161
            Extension: status_request (len=5)
            Extension: supported_groups (len=22)
            Extension: ec_point_formats (len=2)
            Extension: signature_algorithms (len=40)
            Extension: signature_algorithms_cert (len=40)
            Extension: status_request_v2 (len=9)
            Extension: extended_master_secret (len=0)
            Extension: session_ticket (len=0)
            Extension: supported_versions (len=7)
```

This is using OpenJDK 14 and akka-http 10.1.12 on a machine running Ubuntu 20.04 LTS.

**Comment by jrudolph** [comment]
Thanks, @mpdn. I've seen that warning before as well (but not in the docs), but I agree, the warning and the explanation is just wrong.

Not sure about the SNI issue, though. In the test the port is specified at the wrong place in the URI:

```scala
    sniTest("https://check-tls.akamaized.net/v1/tlssni.json:80")
```

should be

```scala
    sniTest("https://check-tls.akamaized.net:80/v1/tlssni.json")
```

but that doesn't work either, as there is no server on that port. When specifying 443 the port is elided because it's the default port, so not sure if it can be tested that way.

**Comment by jrudolph** [comment]
See in #3257 for a fix for the documentation part of this ticket.

**Comment by mpdn** [comment]
Oops, brainfart. The issue might not be with explicit ports then. Seems like it might be something about whether the connection context is specified or not:
```
import akka.actor.ActorSystem
import akka.http.scaladsl.model.{HttpRequest, HttpResponse}
import akka.http.scaladsl.{ConnectionContext, Http}
import javax.net.ssl.SSLContext

import scala.concurrent.duration._
import scala.concurrent.{Await, ExecutionContextExecutor, Future}

object Main {
  private def await[T](fut: Future[T]): T = {
    Await.result(fut, Duration(1, MINUTES))
  }

  def main(args: Array[String]): Unit = {
    implicit val system: ActorSystem = ActorSystem("my-system")
    implicit val executionContext: ExecutionContextExecutor = system.dispatcher

    val sslContext = SSLContext.getInstance("SSL")
    sslContext.init(null, null, null)
    val connectionContext = ConnectionContext.https(sslContext)

    await(Http().bindAndHandleSync(
      _ => HttpResponse(entity = "foo"),
      "localhost",
      8081,
      connectionContext = connectionContext))

    // This has SNI
    try {
      await(Http().singleRequest(HttpRequest(uri = "https://localhost:8081")))
    } catch {
      case _: Exception =>
    }

    // This does not have SNI
    try {
      await(Http().singleRequest(HttpRequest(uri = "https://localhost:8081"),
        connectionContext = connectionContext))
    } catch {
      case _: Exception =>
    }
  }
}
```

Although this needs running wireshark to see the TLS extensions. I couldn't recreate the problem with the site I previously used.

**Comment by mpdn** [comment]
Ah, you have to set the endpoint identification algorithm for the connection context to get SNI:
```
val defaultParameters = sslContext.getDefaultSSLParameters
defaultParameters.setEndpointIdentificationAlgorithm("https")
val connectionContext = ConnectionContext.https(sslContext, sslParameters = Some(defaultParameters))
```

I didn't consider this wasn't part of the default `ConnectionContext.https`, so my mistake. This is probably expected behavior considering Java defaults to non-SNI. It's a bit of a footgun though, maybe it could be documented.

**Comment by jroper** [comment]
It might be worth considering whether SNI should be enabled by default, as it appears it isn't. And if it isn't, perhaps we should document how to enable it - SNI is pretty much assumed to be supported by everything these days, eg, you can't invoke a Cloudstate service running in our infrastructure without it.

**Comment by raboof** [comment]
> It's a bit of a footgun though, maybe it could be documented.

Yes, some changes are brewing in this area for 10.2.0 (https://github.com/akka/akka-http/pull/2983), and we should definitely document the consequences of using the low-level API there

> It might be worth considering whether SNI should be enabled by default

Yes, in https://github.com/akka/akka-http/pull/2983 it'll be enabled for you unless you choose to use the lower-level API yourself (then it's up to you, and we should document that)

**Comment by jrudolph** [comment]
> It's a bit of a footgun though, maybe it could be documented.

As @raboof said, there are some weird gotchas in the `SSLEngine` API, e.g. the order matters how you change settings. E.g. if you use `setClientMode` too late, it might reverse settings you have done before.
